{
  "article": {
    "accepted_date": "2026-07-07",
    "doi": "10.1038/s41598-026-61766-2",
    "journal": "Scientific Reports",
    "publication_status": "published_unedited_early_access",
    "published_date": "2026-07-11",
    "publisher_url": "https://doi.org/10.1038/s41598-026-61766-2",
    "title": "Large language models generate diagnostic likelihood ratios with low mean bias but wide dispersion"
  },
  "category_config": "config/analysis_categories_v1.json",
  "code": [
    {
      "byte_size": 133437,
      "dimensions": {
        "cells": 37
      },
      "path": "data_analysis.ipynb",
      "role": "accepted_primary_analysis_notebook",
      "sha256": "750344edaa2bb228247976c389ab658e697123c790b55ed58fdb36d62907fed3"
    },
    {
      "byte_size": 88692,
      "dimensions": {
        "cells": 23
      },
      "path": "supplementary_analyses.ipynb",
      "role": "accepted_supplementary_analysis_notebook",
      "sha256": "feaf3fae25e493357670b6d6cede5385ec37a2cb20f8c799aec7e6a27264d10d"
    },
    {
      "byte_size": 51996,
      "dimensions": {
        "cells": 11
      },
      "path": "lr_scraper_estimator.ipynb",
      "role": "guarded_historical_collection_and_query_notebook",
      "sha256": "79f966f05c518bd65ff49e11963eed78458485616661e6ce329f8d955ab034ef"
    },
    {
      "byte_size": 34938,
      "dimensions": {
        "cells": 15
      },
      "path": "threshold_perturbation_sensitivity_analysis.ipynb",
      "role": "guarded_threshold_perturbation_notebook",
      "sha256": "f853a3ca46330c489325343a9babf7a8fcf17cad53d1a7a0ba76fb5e0ef60fbe"
    },
    {
      "byte_size": 22248,
      "path": "scripts/build_release_dataset.py",
      "role": "canonical_data_builder",
      "sha256": "fce2209468e339a04f6e98429408af809a5e9f2ea98ea5f9c343f502cdb1de7f"
    },
    {
      "byte_size": 29015,
      "path": "scripts/compute_reference_results.py",
      "role": "reference_result_builder",
      "sha256": "0e62e339424c02064e4d8d6206e5bfcda092129db45ee6a796fafc350a30bf0d"
    },
    {
      "byte_size": 13537,
      "path": "scripts/reproduce_paper.py",
      "role": "offline_reproduction_entrypoint",
      "sha256": "d68ed3d09053b6917470010ecefb09cd2b6a6323afca10a7eeebc54bf54241a8"
    },
    {
      "byte_size": 10751,
      "path": "scripts/build_manifest.py",
      "role": "manifest_builder",
      "sha256": "532d65d36bb8e78869e906e7eddecb59dd26a6e04affb116c486426e0ffb8823"
    },
    {
      "byte_size": 2164,
      "path": "scripts/build_checksums.py",
      "role": "repository_checksum_builder",
      "sha256": "c45718971daafaae38c9e28daad81848b8059bcd4b24286cda416cabd0519d94"
    },
    {
      "byte_size": 5156,
      "path": "scripts/verify_checksums.py",
      "role": "repository_checksum_verifier",
      "sha256": "7966afe502f03c30136dc9830c79f69e94c5e0f3c808f2b294814d7050d9efc7"
    },
    {
      "byte_size": 22803,
      "path": "scripts/validate_release.py",
      "role": "release_contract_validator",
      "sha256": "1587c2e298067937109735e2a84c23189ede315f05dd11e8206abb9ba715af60"
    },
    {
      "byte_size": 18491,
      "path": "scripts/check_release_hygiene.py",
      "role": "public_release_hygiene_gate",
      "sha256": "db447c481a1b32ea706c4a95c827a52bde6827cf9e7b743d3b4b1a78961a9dae"
    },
    {
      "byte_size": 28849,
      "path": "scripts/run_replication.py",
      "role": "guarded_live_replication_entrypoint",
      "sha256": "47b47bcf0e221a457af72f73a423ec38d1ed5c78a52866e31a14fd3f2aad951e"
    },
    {
      "byte_size": 9386,
      "path": "scripts/extract_manuscript_text.py",
      "role": "author_manuscript_text_extractor",
      "sha256": "8d7386f16f448bb406453da74e9f906d0de113de5c1a78ef00a593edd5da0b75"
    },
    {
      "byte_size": 9489,
      "path": "scripts/build_release_archive.py",
      "role": "deterministic_source_archive_builder",
      "sha256": "d0bdd416fd02b329dd8867592276b0c1daa64f2e023c176244e3831fd8d134c0"
    },
    {
      "byte_size": 21721,
      "path": "scripts/build_release_assets.py",
      "role": "github_release_asset_builder",
      "sha256": "8409b8c743fcaa5ea83aacf1dd2023be9104f7d2e6093bf68d1950cbad1bed77"
    },
    {
      "byte_size": 6638,
      "path": "scripts/generate_release_attestation.py",
      "role": "release_attestation_builder",
      "sha256": "be58b0b6a5c01162a1e6ee137dbf281802942f98864d13f95881ba8a1c427641"
    }
  ],
  "configurations": [
    {
      "byte_size": 5,
      "path": ".python-version",
      "role": "python_version_pin",
      "sha256": "49a506dd32096b010d75205acf3430c9ae6c40351888129499e5a5e487126c93"
    },
    {
      "byte_size": 1373,
      "path": "pyproject.toml",
      "role": "primary_python_environment",
      "sha256": "44c6d3d2e0806bfa09eb39bd365de7b0a0a9cc07ed78375a3d621c9a6ed5a144"
    },
    {
      "byte_size": 1162,
      "path": "config/analysis_categories_v1.json",
      "role": "qualitative_lr_category_definition",
      "sha256": "746db3d3a9d3834d0983b45ea1cf10b12aa3950ff7e2bb5c690717793275882c"
    },
    {
      "byte_size": 763,
      "path": "config/manuscript_models_v1.json",
      "role": "accepted_manuscript_model_scope",
      "sha256": "3ea80601002c835909a66c2b70ba325f9120c70ac724c8562d0ed1a3428ece94"
    },
    {
      "byte_size": 4327,
      "path": "manifests/manifest.schema.json",
      "role": "manifest_validation_schema",
      "sha256": "31907fce0c031d7616961c6c7fb24f97156997490ccea95c8a8b455d6b1b3d6b"
    },
    {
      "byte_size": 5,
      "path": "tools/cff/.python-version",
      "role": "cff_validator_python_pin",
      "sha256": "49a506dd32096b010d75205acf3430c9ae6c40351888129499e5a5e487126c93"
    },
    {
      "byte_size": 166,
      "path": "tools/cff/pyproject.toml",
      "role": "cff_validator_environment",
      "sha256": "3847eaeedba9139bb406067ca9e771aa4452e83d4afe3927b95367d9b0db9829"
    },
    {
      "byte_size": 18891,
      "path": "tools/cff/uv.lock",
      "role": "cff_validator_lockfile",
      "sha256": "052b7d0a3f72394e4d1d7224036dfc50f077850654ef441170d9532fa574dc21"
    }
  ],
  "dates": {
    "model_query": "2025-08-25",
    "source_collection": "2025-04-01"
  },
  "environment": {
    "lockfile": "uv.lock",
    "lockfile_sha256": "23a4dd69bc0dd14b8d54905564d9d08395b654139a73f157f7801b21a0bcd08f",
    "python_requirement": ">=3.11"
  },
  "inputs": [
    {
      "byte_size": 52336,
      "dimensions": {
        "columns": 9,
        "rows": 700,
        "sheets": 1
      },
      "path": "NNT_LRs_08-26-2025.xlsx",
      "role": "accepted_analysis_workbook",
      "sha256": "644f0558328a8f04f460a5ebfa2fc04e6d3571f655d084ea076488c7ba17da89"
    },
    {
      "byte_size": 56263,
      "dimensions": {
        "columns": 7,
        "rows": 700,
        "sheets": 30
      },
      "path": "nnt_lrs_with_estimated.xlsx",
      "role": "per_condition_labels_and_historical_outputs",
      "sha256": "c375229a27f0854957f6b8963ece145e94d00e4fa75e7e2756e5d130f6f7110d"
    },
    {
      "byte_size": 219503,
      "dimensions": {
        "columns": 26,
        "rows": 700
      },
      "path": "data/curated/diagnostic_lrs_manuscript_v1.csv",
      "role": "canonical_accepted_analysis_data",
      "sha256": "aff708af1140b1cae05e1eb5abe457036d43f35ba868d706576206f120ccce02"
    },
    {
      "byte_size": 14530,
      "dimensions": {
        "columns": 4,
        "rows": 700
      },
      "path": "data/model_outputs/manuscript_model_outputs_v1.csv",
      "role": "accepted_three_model_outputs",
      "sha256": "15d0772890da4dcc08e9d5eeb497a6da33e86414d2d728cae72bfea5c2780895"
    },
    {
      "byte_size": 32350,
      "dimensions": {
        "columns": 3,
        "rows": 700
      },
      "path": "data/model_outputs/auxiliary_gpt-4.1_outputs_v1.csv",
      "role": "auxiliary_historical_not_analyzed",
      "sha256": "920669700a5cd497a91fb8b1d1eb5c1c372fdaf87c2c2943e62ed669d96f5e75"
    },
    {
      "byte_size": 121730,
      "dimensions": {
        "columns": 10,
        "rows": 700
      },
      "path": "data/provenance/source_crosswalk_v1.csv",
      "role": "strict_workbook_crosswalk",
      "sha256": "cb7aa99813f39ffa96ab2f42517088cfb015266c4bdd687737ee3dcdc3ba9e38"
    }
  ],
  "known_provenance_gaps": [
    {
      "artifact_or_field": "source_url",
      "blocking_for_reproduction": false,
      "description": "Row-level TheNNT source URLs were not stored in the frozen workbooks.",
      "gap_id": "PG-001",
      "status": "not_recovered"
    },
    {
      "artifact_or_field": "source_retrieved_date",
      "blocking_for_reproduction": false,
      "description": "The study-level source collection date is 2025-04-01; row-level retrieval timestamps were not recorded.",
      "gap_id": "PG-002",
      "status": "not_recovered"
    },
    {
      "artifact_or_field": "curation_log",
      "blocking_for_reproduction": false,
      "description": "Row-level curation rationales and reviewer identities were not recovered.",
      "gap_id": "PG-003",
      "status": "not_recovered"
    },
    {
      "artifact_or_field": "response_ids",
      "blocking_for_reproduction": false,
      "description": "Original OpenAI response IDs were not recovered.",
      "gap_id": "PG-004",
      "status": "not_recovered"
    },
    {
      "artifact_or_field": "retry_audit",
      "blocking_for_reproduction": false,
      "description": "No original row-level retry audit was found in the worktree, local ignored files, or Git history.",
      "gap_id": "PG-005",
      "status": "not_recovered"
    },
    {
      "artifact_or_field": "sdk_version",
      "blocking_for_reproduction": false,
      "description": "The exact OpenAI SDK version used for the accepted run was not recorded.",
      "gap_id": "PG-006",
      "status": "not_recovered"
    },
    {
      "artifact_or_field": "raw_api_responses",
      "blocking_for_reproduction": false,